<?xml version="1.0"?>
<schedule user="DaddyLongLegs"
		  xmlns:xsi="http://www.w3.org/2001/XMLSchema-instance"
	      xsi:noNamespaceSchemaLocation="validate.xsd">
	<event id="IMY210101">
		<title>IMY 210 Classes</title>
		<type>Event</type>
		<date repeat="Weekly">	
			<day>2</day>
			<month>March</month>
			<startingTime>03:30 PM</startingTime>
			<endingTime>04:30 PM</endingTime>
		</date>
		<guests>
			<guest>
				<name>Yan</name>
				<email>yan.wong@up.ac.za</email>
			</guest>
			<guest>
				<name>Daddy</name>
				<email>daddylonglegs@gmail.com</email>
			</guest>
		</guests>
		<venue>IT building</venue>
		<description>
			World worst brain surgeon giving class on XML.
		</description>
	</event>
</schedule>